Name,Image,Rarity,Role,Region,Max Power,Max Attack,Max Defense,Max Health,Max Speed,Description
Tweety,Tweety.png,Epic,Attacker,City,26813,963,1278,3913,155,The cutest little bird you ever did taw. Why lift a feather when your allies do the work?
Tweety the Twue,Tweety the Twue.png,Epic,Support,Avalooney,29186,1013,1463,4402,142,A knight banneret who keeps his team well-stocked in both defense and offense.
Valkyrie Bugs,Valkyrie Bugs.png,Epic,Support,Avalooney,28740,1113,1777,3189,155,A support valkyrie who can greatly expedite her team's actions and silence her enemies.
Van Wile,Van Wile.png,Epic,Attacker,Desert,29407,1325,1519,3016,154,A well-equipped Monster hunter with nerves of steel and bullets of silver.
Waiter Elmer,Waiter Elmer.png,Common,Support,City,27652,952,1567,3801,154,The waiter supports his team by healing and empowering his allies especially good when fighting rabbits.
Western Type Hero,Western Type Hero.png,Rare,Attacker,WB Studios,29707,1051,2001,3455,155,Critical striker. Dealing high amounts of damage through his critical skills he's able to quickly defeat his foes.
Wildcard Wolf,Wildcard Wolf.png,Rare,Attacker,Desert,26665,1205,1147,2967,175,Collect Buffs deal crits and Stun or Silence enemies who call this gambler out.
Wile E. Coyote,Wile E. Coyote.png,Epic,Attacker,Desert,28752,1224,1190,3693,168,This must-answer mastermind brings tricks to stifle yours a self-healing appetite for birds and an ever-climbing Attack stat.
Winter Bugs,Winter Bugs.png,Epic,Attacker,Summit,30155,1241,1511,3740,143,With unavoidable Chilly and overwhelming Critical effects this attacker brings the Summit to his enemies.
Witch Hazel,Witch Hazel.png,Rare,Attacker,Avalooney,28263,1013,1582,3873,129,The wicked witch uses Damage Over Time to defeat those who attack her dealing heavy damage.
Witch Lezah,Witch Lezah.png,Common,Support,Space,26110,855,1567,3714,124,The witch supports her team by being hidden and stealing her enemies positive effects!
Witchdoctor Hazel,Witchdoctor Hazel.png,Epic,Defender,Tasmania,29891,1069,1704,4134,118,In the darkest jungle this Taunting witch inflicts DoTs Silence all enemies and buffs the Attack of magic allies.
Yeti Gossamer,Yeti Gossamer.png,Epic,Defender,Summit,32717,1213,1624,4811,119,The blizzard itself bringing the cold to the whole fight. Enemies Freeze while allies thaw just enough.
Yodel Le Pew,Yodel Le Pew.png,Rare,Attacker,Summit,28682,1084,1511,3780,149,This yodeler wears his enemies down with terrible singing turning their strengths against them while shrugging off their critiques.
Yokai Taz,Yokai Taz.png,Epic,Attacker,Forest,32192,1342,1440,4340,126,This spirit of destruction has been summoned from realms beyond to empower Monsters with Critical Damage.
Yosemite Sam,Yosemite Sam.png,Epic,Attacker,Desert,30852,1375,1447,3606,134,Selfish attacker. Deals high damage to enemies and removes attack bonuses from all characters.
Zoot Suit Daffy,Zoot Suit Daffy.png,Epic,Support,City,29492,1325,1334,3370,155,How different it was in my native village... Dodge Chance Flip the enemy team in Silence their buffs removed... And then there was Stun...
